{
 "schema_version": "0.1",
 "project": {
  "id": "T01",
  "name": "Training House T01",
  "nature": "fictional training plan",
  "owner": "ASTRA DWELL training workspace (3D-Model-Training)",
  "permission": "Original fictional layout authored for rehearsal; not a client or ASTRA DWELL production design",
  "units": "m",
  "datum": "Origin at the south-west outer corner of the external walls; z = 0 at finished floor level",
  "notes": "Same 12 x 10 m envelope as HOUSE H01 but an invented layout: H01's drawings were not used. Geometry and dimension register were authored together, so conformance passes by construction; tests mutate the plan to prove the checks catch discrepancies."
 },
 "tolerances": {
  "length": 0.005,
  "area_rel": 0.01
 },
 "sources": [
  {
   "id": "S-01",
   "title": "T01 training sketch plan with room schedule and opening schedule (fictional)",
   "revision": "A",
   "date": "2026-10-19",
   "kind": "plan",
   "scale": "1:100"
  }
 ],
 "dimensions": [
  {
   "id": "D-001",
   "label": "Overall external length, east-west",
   "value": 12.0,
   "status": "CONFIRMED",
   "source": "S-01",
   "check": {
    "kind": "overall",
    "level": "L00",
    "axis": "x"
   }
  },
  {
   "id": "D-002",
   "label": "Overall external width, north-south",
   "value": 10.0,
   "status": "CONFIRMED",
   "source": "S-01",
   "check": {
    "kind": "overall",
    "level": "L00",
    "axis": "y"
   }
  },
  {
   "id": "D-003",
   "label": "Finished floor level (datum)",
   "value": 0.0,
   "status": "CONFIRMED",
   "source": "S-01",
   "check": {
    "kind": "param",
    "targets": [
     "levels.L00.elevation"
    ]
   }
  },
  {
   "id": "D-010",
   "label": "External wall thickness",
   "value": 0.23,
   "status": "CONFIRMED",
   "source": "S-01",
   "check": {
    "kind": "param",
    "targets": [
     "wall_types.EXT.thickness"
    ]
   }
  },
  {
   "id": "D-011",
   "label": "Internal partition thickness",
   "value": 0.115,
   "status": "INFERRED",
   "source": "S-01",
   "check": {
    "kind": "param",
    "targets": [
     "wall_types.INT.thickness"
    ]
   },
   "note": "Partitions not dimensioned on S-01; assumed half-brick 115 mm"
  },
  {
   "id": "D-020",
   "label": "Floor to ceiling height",
   "value": 3.0,
   "status": "INFERRED",
   "source": "S-01",
   "check": {
    "kind": "param",
    "targets": [
     "levels.L00.wall_height"
    ]
   },
   "note": "No section supplied; typical residential value assumed"
  },
  {
   "id": "D-021",
   "label": "Floor build-up below FFL",
   "value": 0.15,
   "status": "INFERRED",
   "source": "S-01",
   "check": {
    "kind": "param",
    "targets": [
     "levels.L00.floor_thickness"
    ]
   },
   "note": "Visual only; no structural meaning"
  },
  {
   "id": "D-022",
   "label": "Roof slab thickness",
   "value": 0.15,
   "status": "INFERRED",
   "source": "S-01",
   "check": {
    "kind": "param",
    "targets": [
     "levels.L00.roof_thickness"
    ]
   },
   "note": "Visual only; no structural meaning"
  },
  {
   "id": "D-030",
   "label": "Door height (D1, D2, D3)",
   "value": 2.1,
   "status": "CONFIRMED",
   "source": "S-01",
   "check": {
    "kind": "param",
    "targets": [
     "openings.O01.height",
     "openings.O09.height",
     "openings.O10.height",
     "openings.O11.height",
     "openings.O13.height",
     "openings.O14.height",
     "openings.O15.height"
    ]
   }
  },
  {
   "id": "D-031",
   "label": "Main door width (D1)",
   "value": 1.0,
   "status": "CONFIRMED",
   "source": "S-01",
   "check": {
    "kind": "param",
    "targets": [
     "openings.O01.width"
    ]
   }
  },
  {
   "id": "D-032",
   "label": "Internal door width (D2)",
   "value": 0.9,
   "status": "CONFIRMED",
   "source": "S-01",
   "check": {
    "kind": "param",
    "targets": [
     "openings.O09.width",
     "openings.O10.width",
     "openings.O11.width",
     "openings.O15.width"
    ]
   }
  },
  {
   "id": "D-033",
   "label": "Toilet door width (D3)",
   "value": 0.75,
   "status": "CONFIRMED",
   "source": "S-01",
   "check": {
    "kind": "param",
    "targets": [
     "openings.O13.width",
     "openings.O14.width"
    ]
   }
  },
  {
   "id": "D-034",
   "label": "Living-dining arch width (A1)",
   "value": 1.6,
   "status": "CONFIRMED",
   "source": "S-01",
   "check": {
    "kind": "param",
    "targets": [
     "openings.O12.width"
    ]
   }
  },
  {
   "id": "D-035",
   "label": "Living-dining arch height (A1)",
   "value": 2.4,
   "status": "CONFIRMED",
   "source": "S-01",
   "check": {
    "kind": "param",
    "targets": [
     "openings.O12.height"
    ]
   }
  },
  {
   "id": "D-036",
   "label": "Door and arch sill (flush threshold)",
   "value": 0.0,
   "status": "CONFIRMED",
   "source": "S-01",
   "check": {
    "kind": "param",
    "targets": [
     "openings.O01.sill",
     "openings.O09.sill",
     "openings.O10.sill",
     "openings.O11.sill",
     "openings.O12.sill",
     "openings.O13.sill",
     "openings.O14.sill",
     "openings.O15.sill"
    ]
   }
  },
  {
   "id": "D-040",
   "label": "Window WN1 width",
   "value": 1.5,
   "status": "CONFIRMED",
   "source": "S-01",
   "check": {
    "kind": "param",
    "targets": [
     "openings.O02.width",
     "openings.O03.width",
     "openings.O05.width",
     "openings.O07.width",
     "openings.O08.width"
    ]
   }
  },
  {
   "id": "D-041",
   "label": "Window WN1 height",
   "value": 1.2,
   "status": "CONFIRMED",
   "source": "S-01",
   "check": {
    "kind": "param",
    "targets": [
     "openings.O02.height",
     "openings.O03.height",
     "openings.O05.height",
     "openings.O07.height",
     "openings.O08.height"
    ]
   }
  },
  {
   "id": "D-042",
   "label": "Window WN1 sill",
   "value": 0.9,
   "status": "CONFIRMED",
   "source": "S-01",
   "check": {
    "kind": "param",
    "targets": [
     "openings.O02.sill",
     "openings.O03.sill",
     "openings.O05.sill",
     "openings.O07.sill",
     "openings.O08.sill"
    ]
   }
  },
  {
   "id": "D-043",
   "label": "Window WN2 (kitchen) width",
   "value": 1.2,
   "status": "CONFIRMED",
   "source": "S-01",
   "check": {
    "kind": "param",
    "targets": [
     "openings.O04.width"
    ]
   }
  },
  {
   "id": "D-044",
   "label": "Window WN2 (kitchen) height",
   "value": 1.05,
   "status": "CONFIRMED",
   "source": "S-01",
   "check": {
    "kind": "param",
    "targets": [
     "openings.O04.height"
    ]
   }
  },
  {
   "id": "D-045",
   "label": "Window WN2 (kitchen) sill",
   "value": 1.05,
   "status": "CONFIRMED",
   "source": "S-01",
   "check": {
    "kind": "param",
    "targets": [
     "openings.O04.sill"
    ]
   }
  },
  {
   "id": "D-046",
   "label": "Ventilator WN3 width",
   "value": 0.6,
   "status": "CONFIRMED",
   "source": "S-01",
   "check": {
    "kind": "param",
    "targets": [
     "openings.O06.width"
    ]
   }
  },
  {
   "id": "D-047",
   "label": "Ventilator WN3 height",
   "value": 0.6,
   "status": "CONFIRMED",
   "source": "S-01",
   "check": {
    "kind": "param",
    "targets": [
     "openings.O06.height"
    ]
   }
  },
  {
   "id": "D-048",
   "label": "Ventilator WN3 sill",
   "value": 1.5,
   "status": "CONFIRMED",
   "source": "S-01",
   "check": {
    "kind": "param",
    "targets": [
     "openings.O06.sill"
    ]
   }
  },
  {
   "id": "D-050",
   "label": "Opening positions along walls: scaling uncertainty",
   "value": 0.025,
   "status": "INFERRED",
   "source": "S-01",
   "check": {
    "kind": "none"
   },
   "note": "Openings are not dimensioned on S-01; positions scaled from the drawing (expect +/-25 mm)"
  },
  {
   "id": "D-060",
   "label": "Living clear width (E-W)",
   "value": 4.885,
   "status": "CONFIRMED",
   "source": "S-01",
   "check": {
    "kind": "room_clear",
    "room": "R01",
    "axis": "x"
   }
  },
  {
   "id": "D-061",
   "label": "Living clear depth (N-S)",
   "value": 4.7125,
   "status": "CONFIRMED",
   "source": "S-01",
   "check": {
    "kind": "room_clear",
    "room": "R01",
    "axis": "y"
   }
  },
  {
   "id": "D-062",
   "label": "Bedroom 3 clear width (E-W)",
   "value": 3.1125,
   "status": "CONFIRMED",
   "source": "S-01",
   "check": {
    "kind": "room_clear",
    "room": "R02",
    "axis": "x"
   }
  },
  {
   "id": "D-063",
   "label": "Bedroom 3 clear depth (N-S)",
   "value": 4.7125,
   "status": "CONFIRMED",
   "source": "S-01",
   "check": {
    "kind": "room_clear",
    "room": "R02",
    "axis": "y"
   }
  },
  {
   "id": "D-064",
   "label": "Kitchen clear width (E-W)",
   "value": 3.3125,
   "status": "CONFIRMED",
   "source": "S-01",
   "check": {
    "kind": "room_clear",
    "room": "R03",
    "axis": "x"
   }
  },
  {
   "id": "D-065",
   "label": "Kitchen clear depth (N-S)",
   "value": 4.7125,
   "status": "CONFIRMED",
   "source": "S-01",
   "check": {
    "kind": "room_clear",
    "room": "R03",
    "axis": "y"
   }
  },
  {
   "id": "D-066",
   "label": "Bedroom 1 (master) clear width (E-W)",
   "value": 4.3125,
   "status": "CONFIRMED",
   "source": "S-01",
   "check": {
    "kind": "room_clear",
    "room": "R04",
    "axis": "x"
   }
  },
  {
   "id": "D-067",
   "label": "Bedroom 1 (master) clear depth (N-S)",
   "value": 4.7125,
   "status": "CONFIRMED",
   "source": "S-01",
   "check": {
    "kind": "room_clear",
    "room": "R04",
    "axis": "y"
   }
  },
  {
   "id": "D-068",
   "label": "Toilet 1 clear width (E-W)",
   "value": 1.685,
   "status": "CONFIRMED",
   "source": "S-01",
   "check": {
    "kind": "room_clear",
    "room": "R05",
    "axis": "x"
   }
  },
  {
   "id": "D-069",
   "label": "Toilet 1 clear depth (N-S)",
   "value": 2.3125,
   "status": "CONFIRMED",
   "source": "S-01",
   "check": {
    "kind": "room_clear",
    "room": "R05",
    "axis": "y"
   }
  },
  {
   "id": "D-070",
   "label": "Toilet 2 clear width (E-W)",
   "value": 1.685,
   "status": "CONFIRMED",
   "source": "S-01",
   "check": {
    "kind": "room_clear",
    "room": "R06",